{
  "ir_version": "0.1",
  "source": { "file": "project.toml" },
  "project": {
    "name": "local-lib-demo",
    "version": "0.1.0",
    "format": "0.1"
  },
  "libs": [
    { "id": "kicad", "source": "kicad-official", "version": "9.0" },
    {
      "id": "proj",
      "source": "project",
      "path": "footprints/project",
      "content_hash": "6b86b273ff34fce19d6b804eff5a3f5747ada4eaa22f1d49c01e52ddb7875b4b"
    }
  ]
}
